{
  "schema_version": "1.0.0",
  "list_version": "202609032013",
  "generated_at": "2026-09-03T20:13:13Z",
  "update_interval_hours": 72,
  "project": {
    "name": "hapara.fail Blocklist",
    "homepage": "https://www.hapara.fail/",
    "repository": "https://github.com/hapara-fail/blocklist",
    "license": "GPL-3.0-only",
    "license_url": "https://github.com/hapara-fail/blocklist/blob/main/LICENSE",
    "description": "Blocks school-mandated surveillance software, spyware, and other invasive educational technology services."
  },
  "entry_count": 280,
  "block_entry_count": 279,
  "allow_entry_count": 1,
  "entries": [
    {
      "action": "block",
      "domain": "300624.com",
      "unicode_domain": "300624.com",
      "service": "FamiSafe",
      "category": "parental-control",
      "description": "",
      "source": "",
      "added": ""
    },
    {
      "action": "block",
      "domain": "5rw61tcrl5.execute-api.us-west-2.amazonaws.com",
      "unicode_domain": "5rw61tcrl5.execute-api.us-west-2.amazonaws.com",
      "service": "Lightspeed Systems",
      "category": "filtering",
      "description": "Known patched/failsafe behavior; see README.",
      "source": "",
      "added": ""
    },
    {
      "action": "block",
      "domain": "a-fallback-lightspeed.ably.io",
      "unicode_domain": "a-fallback-lightspeed.ably.io",
      "service": "Lightspeed Systems",
      "category": "filtering",
      "description": "Known patched/failsafe behavior; see README.",
      "source": "",
      "added": ""
    },
    {
      "action": "block",
      "domain": "accountable2you-android.firebaseio.com",
      "unicode_domain": "accountable2you-android.firebaseio.com",
      "service": "Accountable2You",
      "category": "parental-control",
      "description": "",
      "source": "",
      "added": ""
    },
    {
      "action": "block",
      "domain": "accountable2you.com",
      "unicode_domain": "accountable2you.com",
      "service": "Accountable2You",
      "category": "parental-control",
      "description": "",
      "source": "",
      "added": ""
    },
    {
      "action": "block",
      "domain": "amplifiedit.com",
      "unicode_domain": "amplifiedit.com",
      "service": "Gopher",
      "category": "device-management",
      "description": "",
      "source": "",
      "added": ""
    },
    {
      "action": "block",
      "domain": "apisanta.com",
      "unicode_domain": "apisanta.com",
      "service": "Deledao",
      "category": "filtering",
      "description": "",
      "source": "",
      "added": ""
    },
    {
      "action": "block",
      "domain": "aristotlek12.com",
      "unicode_domain": "aristotlek12.com",
      "service": "AristotleK12",
      "category": "monitoring",
      "description": "",
      "source": "",
      "added": ""
    },
    {
      "action": "block",
      "domain": "ativion.com",
      "unicode_domain": "ativion.com",
      "service": "Ativion Software",
      "category": "monitoring",
      "description": "",
      "source": "",
      "added": ""
    },
    {
      "action": "block",
      "domain": "ativionnx.com",
      "unicode_domain": "ativionnx.com",
      "service": "Ativion Software",
      "category": "monitoring",
      "description": "",
      "source": "",
      "added": ""
    },
    {
      "action": "block",
      "domain": "b-fallback-lightspeed.ably.io",
      "unicode_domain": "b-fallback-lightspeed.ably.io",
      "service": "Lightspeed Systems",
      "category": "filtering",
      "description": "Known patched/failsafe behavior; see README.",
      "source": "",
      "added": ""
    },
    {
      "action": "block",
      "domain": "b16rt683ll.execute-api.us-west-2.amazonaws.com",
      "unicode_domain": "b16rt683ll.execute-api.us-west-2.amazonaws.com",
      "service": "Lightspeed Systems",
      "category": "filtering",
      "description": "Known patched/failsafe behavior; see README.",
      "source": "",
      "added": ""
    },
    {
      "action": "block",
      "domain": "bark.app",
      "unicode_domain": "bark.app",
      "service": "Bark",
      "category": "monitoring",
      "description": "",
      "source": "",
      "added": ""
    },
    {
      "action": "block",
      "domain": "bark.us",
      "unicode_domain": "bark.us",
      "service": "Bark",
      "category": "monitoring",
      "description": "",
      "source": "",
      "added": ""
    },
    {
      "action": "block",
      "domain": "barkforschools.com",
      "unicode_domain": "barkforschools.com",
      "service": "Bark",
      "category": "monitoring",
      "description": "",
      "source": "",
      "added": ""
    },
    {
      "action": "block",
      "domain": "beacon-report-uploads-prod.s3.us-west-2.amazonaws.com",
      "unicode_domain": "beacon-report-uploads-prod.s3.us-west-2.amazonaws.com",
      "service": "GoGuardian",
      "category": "monitoring",
      "description": "Known patched/failsafe behavior; see README.",
      "source": "",
      "added": ""
    },
    {
      "action": "block",
      "domain": "block.si",
      "unicode_domain": "block.si",
      "service": "Blocksi",
      "category": "filtering",
      "description": "",
      "source": "",
      "added": ""
    },
    {
      "action": "block",
      "domain": "block.tools",
      "unicode_domain": "block.tools",
      "service": "Linewize / Qoria / FamilyZone / Sphirewall",
      "category": "filtering",
      "description": "",
      "source": "",
      "added": ""
    },
    {
      "action": "block",
      "domain": "blocksi-dns.appspot.com",
      "unicode_domain": "blocksi-dns.appspot.com",
      "service": "Blocksi",
      "category": "filtering",
      "description": "",
      "source": "",
      "added": ""
    },
    {
      "action": "block",
      "domain": "blocksi.net",
      "unicode_domain": "blocksi.net",
      "service": "Blocksi",
      "category": "filtering",
      "description": "",
      "source": "",
      "added": ""
    },
    {
      "action": "block",
      "domain": "blocksicloud.com",
      "unicode_domain": "blocksicloud.com",
      "service": "Blocksi",
      "category": "filtering",
      "description": "",
      "source": "",
      "added": ""
    },
    {
      "action": "block",
      "domain": "blocksicloud.net",
      "unicode_domain": "blocksicloud.net",
      "service": "Blocksi",
      "category": "filtering",
      "description": "",
      "source": "",
      "added": ""
    },
    {
      "action": "block",
      "domain": "brm-v3.appspot.com",
      "unicode_domain": "brm-v3.appspot.com",
      "service": "Blocksi",
      "category": "filtering",
      "description": "",
      "source": "",
      "added": ""
    },
    {
      "action": "block",
      "domain": "c-fallback-lightspeed.ably.io",
      "unicode_domain": "c-fallback-lightspeed.ably.io",
      "service": "Lightspeed Systems",
      "category": "filtering",
      "description": "Known patched/failsafe behavior; see README.",
      "source": "",
      "added": ""
    },
    {
      "action": "block",
      "domain": "canopy.us",
      "unicode_domain": "canopy.us",
      "service": "General Parental Control",
      "category": "parental-control",
      "description": "",
      "source": "",
      "added": ""
    },
    {
      "action": "block",
      "domain": "catchon.com",
      "unicode_domain": "catchon.com",
      "service": "Lightspeed Systems",
      "category": "filtering",
      "description": "Known patched/failsafe behavior; see README.",
      "source": "",
      "added": ""
    },
    {
      "action": "block",
      "domain": "cipafilter.com",
      "unicode_domain": "cipafilter.com",
      "service": "Linewize / Qoria / FamilyZone / Sphirewall",
      "category": "filtering",
      "description": "",
      "source": "",
      "added": ""
    },
    {
      "action": "block",
      "domain": "ck-express.com",
      "unicode_domain": "ck-express.com",
      "service": "Ativion Software",
      "category": "monitoring",
      "description": "",
      "source": "",
      "added": ""
    },
    {
      "action": "block",
      "domain": "clevguard.com",
      "unicode_domain": "clevguard.com",
      "service": "ClevGuard / KidsGuard",
      "category": "parental-control",
      "description": "",
      "source": "",
      "added": ""
    },
    {
      "action": "block",
      "domain": "clevguard.org",
      "unicode_domain": "clevguard.org",
      "service": "ClevGuard / KidsGuard",
      "category": "parental-control",
      "description": "",
      "source": "",
      "added": ""
    },
    {
      "action": "block",
      "domain": "contentkeeper.com",
      "unicode_domain": "contentkeeper.com",
      "service": "Ativion Software",
      "category": "monitoring",
      "description": "",
      "source": "",
      "added": ""
    },
    {
      "action": "block",
      "domain": "contentkeeper.io",
      "unicode_domain": "contentkeeper.io",
      "service": "Ativion Software",
      "category": "monitoring",
      "description": "",
      "source": "",
      "added": ""
    },
    {
      "action": "block",
      "domain": "contentkeeper.net",
      "unicode_domain": "contentkeeper.net",
      "service": "Ativion Software",
      "category": "monitoring",
      "description": "",
      "source": "",
      "added": ""
    },
    {
      "action": "block",
      "domain": "contentwatch.com",
      "unicode_domain": "contentwatch.com",
      "service": "General Parental Control",
      "category": "parental-control",
      "description": "",
      "source": "",
      "added": ""
    },
    {
      "action": "block",
      "domain": "custodio.com",
      "unicode_domain": "custodio.com",
      "service": "Linewize / Qoria / FamilyZone / Sphirewall",
      "category": "filtering",
      "description": "",
      "source": "",
      "added": ""
    },
    {
      "action": "block",
      "domain": "deepfreeze.com",